"url","fecha","medio","titulo","cuerpo"
"https://www.pagina12.com.ar/472685-la-inflacion-de-julio-fue-record-desde-2002","2022-07","Pagina12","La inflación de julio fue récord desde 2002","La inflación de julio llegó al 7,4 por ciento mensual, el nivel más alto desde la explosión de la convertibilidad, informó el Indec. En los siete primeros meses, los precios acumulan un incremento del 46,2 por ciento y en la comparación anual el número se ubica en el 71 por ciento, lo cual no tiene antecedentes desde los últimos coletazos de la hiperinflación que terminó con el gobierno de Raúl Alfonsín y abrió la puerta al ciclo neoliberal. Para fin de año, la inflación podría superar el 90 por ciento. ""Claro que veo lo que pasa con los precios. Por eso dejamos todas las paritarias abiertas para que los sueldos le ganen a la inflación y anunciamos el aumento para los jubilados y un bono especial. Y mientras tanto hacemos desde el Estado los esfuerzos que corresponden para resolver el problema"", dijo el presidente, Alberto Fernández. La disparada de precios en julio no se explica porque un nuevo giro de la guerra en Ucrania que haya tenido impacto en los commodities ni en una disparada del tipo de cambio oficial. Lo que sucedió el mes pasado fue que se salió de cauce la crisis política al interior de la coalición gobernante, con el punto culmine en la renuncia intempestiva del ministro Martín Guzmán el sábado 2 de julio y las siguientes 48 horas sin autoridades en el Palacio de Hacienda ni puentes de diálogo entre el presidente, Alberto Fernández, y la vicepresidenta Cristina Fernández de Kirchner. El descontrol de la brecha cambiaria en un contexto de restricción de importaciones y una crisis política en el propio gobierno de dimensiones inéditas provocó que durante varias jornadas las cadenas de suministro se rompieran, con listas sin precios, retención de mercadería o venta a remito abierto. La falta de referencia sobre el costo de reposición de la mercadería en un contexto de fuerte demanda fue el caldo de cultivo para una remarcación masiva. En el Gobierno resumen: ""el costo de una devaluación, sin haber devaluado"". La crisis política se montó sobre varias semanas de presión cambiaria y financiera. En la segunda semana de junio, se derrumbó la cotización de los bonos públicos atados a la inflación, lo cual despertó dudas acerca de la capacidad de refinanciación de los títulos, en el marco de las restricciones de emisión que introdujo el acuerdo con el FMI. En aquel momento, Juntos por el Cambio hizo correr un rumor de nuevo reperfilamiento, lo cual agitó fantasmas que se agrandaron aún más ante la falta de una respuesta contundente de parte del Gobierno. A partir de la mitad de junio, comenzó la corrida cambiaria, lo cual hizo que la cotización del dólar paralelo avanzara en dos semanas desde 212 a 234 pesos, un 10 por ciento. En medio de esa carrera se produjo la renuncia de Guzmán, el posterior vacío en Hacienda y la asunción de Silvina Batakis, una economista con experiencia pero que no generó la confianza suficiente acerca de la solidez del nuevo acuerdo político entre las patas de la coalición. El jueves 28 de julio, el Gobierno anunció la fusión de varias carteras en manos del nuevo ministro de Economía, Sergio Massa. El dólar paralelo pasó de 235 pesos a principios de julio hasta un pico de 328 pesos el día 22 (suba del 40 por ciento), para terminar el mes en 286 pesos. Un derrotero similar registraron los bonos soberanos y el riesgo país. Solo en julio, el Banco Central perdió 4 mil millones de dólares de reservas internacionales, al tiempo que el tipo de cambio oficial subió en ese período un 4 por ciento. También jugaron en la inflación del mes las subas de algunos precios regulados, como prepagas y telecomunicaciones. El rubro de equipamiento y mantenimiento del hogar, donde pesan fuerte las importaciones de productos terminados e insumos, tuvo una suba mensual del 10,3 por ciento, mientras que en prendas de vestir el incremento fue del 8,5, con un avance interanual que asciende al 96,7 por ciento. En alimentos y bebidas, la suba fue del 6 por ciento mensual, por debajo del aumento que había en junio, del 6,7. El informe de precios del CEPA destaca los incrementos mensuales en cebolla (57,9), lechuga (40,5), batata (36,5), zapallo anco (18,4) y banana (17,4). Además de la situación general, en recreación y cultura jugó el componente estacional y fue el rubro lideró el índice de inflación, con el 13,2 por ciento. En tanto, restaurantes y hoteles sumó un 9,8 y en doce meses alcanza el 90,6 por ciento. También se produjeron subas de precios regulados por el Estado, como es el caso del 4 por ciento de las prepagas, lo cual junto al fuerte alza de los medicamentos hizo que el rubro salud avanzara un 6,8 en el mes. En el caso de vivienda, agua, electricidad y otros combustibles, el incremento promedio fue de 4,6 por ciento. En transporte, el alza fue del 5,5, al igual que telecomunicaciones, por la oficialización de las subas de 9,5 por ciento en cable e internet. El ministro Massa dijo días atrás que julio y agosto serían meses muy malos en términos inflacionarios, pero que a partir de allí el índice irá a la baja. El herramental que plantea el Gobierno en términos de precios por ahora se concentra en el ordenamiento macroeconómico, que apunta a bajar el nivel de incertidumbre y reducir la brecha cambiaria. El nuevo secretario de Comercio es Matías Tombolini, quien está comenzando la ronda de reuniones con las empresas de consumo masivo. Como novedad frente a gestiones anteriores, también tendrá a su cargo la botonera de las licencias de importación, con lo cual se espera que vincule su aprobación a los compromisos de precios."
"https://www.lanacion.com.ar/economia/la-inflacion-ya-supero-la-peor-marca-de-macri-alcanzo-el-mayor-numero-en-mas-de-30-anos-y-se-nid14092022/","2022-08","La Nación","La inflación de agosto fue de 7%, superó la peor marca de Macri y alcanzó el mayor número en más de 30 años","No es el hito que Alberto Fernández hubiera querido festejar en sus 1001 días de gobierno, pero es lo que se vive en la calle y al que se enfrentan los argentinos. El aumento de la inflación en agosto reflejó una variación de 7% y acumuló en lo que va del año un avance de 56,4%, un número que ya perforó el récord que dejó Mauricio Macri en 2019 (53,8%), el salto de los precios más elevado en más de casi 30 años, o sea, el registrado tras la hiperinflación (1991). El dato mensual de agosto fue el más alto desde abril de 2002 (10,4%). El incremento en los últimos doce meses fue de 78,5%, el peor desde diciembre de 1991 (84%). La inflación núcleo -que elimina los precios regulados y estacionales- llegó al 6,8% en el mes. El capítulo de Alimentos y Bebidas -el que más pesa en el IPC del Indec- registró un alza de 7,1%. Los analistas creen que los precios mantienen un fuerte ritmo de avance este mes, sobre todo los alimentos, y estiman que el índice de inflación oficial cerrará el año en un número que casi inevitablemente será de tres dígitos. A fines de agosto del mes pasado, los especialistas privados consultados por el Banco Central (BCRA) para el Relevamiento de Expectativas del Mercado (REM) habían proyectado que la inflación a fin de año se ubicará en 95%, o sea, unos 4,8 puntos porcentuales por encima del pronóstico de la encuesta previa. Quienes mejor pronosticaron esa variable para el corto plazo esperan en promedio una inflación de 99,4%. Para agosto, la mediana de las estimaciones del relevamiento preveía un 6,5% mensual, mientras que el promedio del TOP-10 de los mejores pronosticadores la había estimado en 6,8%. Esto implica que el dato difundido ayer por el organismo estadístico que dirige Marco Lavagna está por encima de las estimaciones de los privados. La mayor suba del mes se dio en el rubro Prendas de Vestir y Calzado (9,9%). Detrás vinieron Bienes y servicios varios (8,7%), Equipamiento y mantenimiento del Hogar (8,4%), y el ya mencionado Alimentos y bebidas (7,1%). La ropa ya subió un 109% en doce meses. Restaurante y hoteles se acerca a esa marca: 97,5%. “Mi obligación es con los últimos”, dijo Alberto Fernández ayer en Twitter. “1000 días del gobierno de Alberto Fernández y Cristina Kirchner con decisiones siempre en favor del pueblo”, le respondió el canciller Santiago Cafiero, pese al impacto que tienen los precios en los ingresos, sobre todo de aquellos que menos tienen en la Argentina. “Pensemos que en EE.UU. [la inflación] salta de 1 a 10, un 900% de inflación tuvo. Hay un momento muy excepcional que está viviendo el mundo”, quiso explicar el Presidente en una entrevista televisiva difundida en las últimas horas. La inflación interanual de EE.UU. llegó a 8,3% interanual en agosto y la Reserva Federal (FED) se prepara para volver a subir fuertemente su tasa de interés en los próximos días. En sintonía, en el mercado local, se espera que el dato de hoy movilice mañana al BCRA a volver a subir las tasas. En su última conferencia de prensa, cuando presentó “dólar soja”, el ministro de Economía, Sergio Massa, reafirmó que la inflación es un problema macroeconómico y que para enfrentarlo cumplirá con las metas previstas en el acuerdo con el Fondo Monetario Internacional (FMI), que implican la acumulación de reservas, un sendero de reducción del déficit fiscal y la baja de la emisión para asistir al Tesoro. Tras su viaje a los EE.UU., trascendió que la idea del equipo económico del líder del Frente Renovador es lograr -bajos esas premisas- desacelerar los precios al 2% mensual a fines de año. “Existe un compromiso muy fuerte de la Argentina con el programa y el reconocimiento de que el programa es un ancla para la economía argentina. No tienen el lujo de otras anclas”, afirmó ayer la directora gerente del FMI, Kristalina Georgieva al responder una pregunta sobre el país al final de una charla organizada por el Centro para el Desarrollo Global. “El Ministro Massa vino junto con el gobernador del Banco Central y las personas claves de su equipo y esa es una buena señal, que tenemos un enfoque de todo el Gobierno para implementar el programa. Estamos en un momento en el que, él reconoció sobriamente, yo reconocí sobriamente, que los problemas que enfrenta la Argentina son muy significativos y al tope de la lista está la inflación, que es devastadora especialmente para los pobres de la Argentina”, agregó. “Se cambió nuevamente de régimen inflacionario”, indicó Marina Dal Poggetto, directora de la consultora EcoGo. “Es poco que la inflación esté en 2023 por debajo de lo que vemos este año. Si puede estar o no por encima dependerá de la demanda de pesos, qué instrumentos se usen para sostener esa demanda y de la credibilidad de los mismos”, estimó la economista. “Este es un modelo que requiere inflación para corregir fiscalmente y, al mismo tiempo, modificar precios relativos te da niveles cada vez más altos y más seguidos incrementos de precios”, cerró Dal Poggetto. “Las presiones por reacomodamiento de precios relativos siguen presentes y el dato sigue reflejando un régimen de alta inflación”, afirmó Melisa Sala, economista de la consultora LCG. “Esta inercia pone un piso de inflación por encima del 6% para el resto del año, lo que implica cerrar el año con inflación cercana a los tres dígitos”. La experta dijo que la “Argentina está lanzada a un régimen de altísima inflación, algo que es muy preocupante”. En tanto, la economista describió que lo de agosto recogió el “repricing” del salto de la brecha en medio de la incertidumbre que se generó en julio con la renuncia de Martín Guzmán. El del bimestre julio-agosto fue un fogonazo más elevado del de marzo-abril, y según Bacigalupo, se generó por cuestiones endógenas y no exógenas. “Septiembre va a venir salado”, indicó Bacigalupo y enumeró los ajustes que llegaron en prepagas, subtes, tarifas y un crawling peg más acelerado (que arrancó en una tasa mensualizada de 6,8% en septiembre), aunque dijo que el número puede ser menor al de agosto por la relativa estabilización que produjeron las medidas tomadas por Massa y las expectativas que generaron en el sector privado. “La pérdida del poder adquisitivo va a ser significativa y va a empujar una retracción de la demanda, pese a que habrá personas que usen ahorros o se endeuden para comprar igual en medio de la incertidumbre”, agregó la economista de Abeceb. “La desaceleración fue más baja a lo esperado respecto al pico de julio, de 7,4%”, dijo Agostina Myronec, economista de Ecolatina. “Esto deja en evidencia que el proceso inflacionario se volvió más sensible a shocks ante una macroeconomía debilitada; en otros periodos, el mecanismo de transmisión de restricciones a las importaciones y alza de dólares paralelos era más débil, menos sensible a la inflación. A diferencia, en estos últimos meses, este mecanismo se volvió mucho más robusto, y dejó como resultado pisos de inflación más firmes y difíciles de desarmar a futuro”, agregó. “Para septiembre esperamos un número algo menor al de agosto, pero de todas maneras elevado, por encima del 6%. A la elevada inercia inflacionaria se le suma un deslizamiento del dólar oficial en torno al 6%, sumado a que también va a impactar el aumento de precios regulados, como tarifas de servicios públicos, las tarifas de subte y taxis y aumento de empleadas domésticas. Con estos números, la inflación ya va a cerrar por encima del 95% en 2022″, estimó. Secciones Revistas Redes sociales: Descargá la app: © Copyright 2025 SA LA NACION | Todos los derechos reservados. Dirección Nacional del Derecho de Autor DNDA - EXPEDIENTE DNDA (renovación) RL-2023-95334553-APN-DNDA#MJ. Queda prohibida la reproducción total o parcial del presente diario. Protegido por reCAPTCHA: CondicionesPrivacidad Miembro de GDA. Grupo de Diarios América"
"https://www.pagina12.com.ar/482076-la-inflacion-de-agosto-se-mantuvo-en-7-por-ciento","2022-08","Pagina12","Por qué la inflación de agosto se mantuvo en 7 por ciento","La inflación de agosto se ubicó en el 7 por ciento respecto de julio, informó el Indec. La suba de precios durante el mes pasado fue incluso más alta de lo que se especulaba, ya que las consultoras apuntaban a un valor de alrededor de 6,5 por ciento, lo cual si bien era altísimo en términos históricos, hubiera marcado una mayor desaceleración en relación a la explosión de precios de julio, que fue del 7,4 por ciento. Los primeros registros de septiembre, según miden en el Banco Central, siguen más o menos en la misma línea que julio y agosto, de modo que se vuelve posible el escenario de que para diciembre la inflación anual llegue a las tres cifras. De acuerdo a la UMET, si la suba de precios mensual a partir de este mes fuera de 6 por ciento mensual, para fin de año estaría en el orden del 97,4 por ciento interanual. Por ahora, la inflación en relación a agosto de 2021 es del 78,5 por ciento y en ocho meses acumula un 56,4 por ciento. A esta altura de septiembre, el incremento de precios acumulado desde enero ya debe andar rozando el doble de la meta de 33 por ciento que a fines del año pasado se había puesto el ex ministro de Economía, Martín Guzmán, para todo el 2022. En aquel momento, cuando el gobierno trataba de que se apruebe el proyecto de Presupuesto, que finalmente la oposición bloqueó, esa estimación del 33 por ciento ya lucía demasiado optimista; hoy parece ciencia ficción. Los datos de inflación de julio (7,4 por ciento mensual) y de agosto (7,0) están en los registros mensuales más elevados de los últimos 30 años. Además, tanto la inflación acumulada en ocho meses como la interanual son los valores más elevados desde 1991, cuando daba sus últimos coletazos la hiperinflación que obligó a Raúl Alfonsín a un traspaso anticipado de mando. Hasta ahora, el equipo económico liderado por Sergio Massa se concentró en la recuperación de las reservas en el Banco Central, que en definitiva son sinónimo de gobernabilidad. Pero más temprano que tarde tendrá que proponer herramientas nuevas y más poderosas para quebrar la dinámica de los precios. El régimen de precios en Argentina a esta altura se caracteriza como de ""alta inflación"", que consiste en un acortamiento de los plazos de referencia y la desaparición de los contratos a mayores plazos. Esta dinámica no se resuelve con un pacto de caballeros entre funcionarios y representantes de las grandes empresas de consumo masivo. El índice de 7 por ciento de inflación de agosto se dio a pesar de que bajaron los precios internacionales de los alimentos, se redujeron las cotizaciones paralelas del dólar y el oficial subió por debajo de los precios. El rubro que más aumentó en agosto fue prendas de vestir, con el 9,9 por ciento, con lo cual ya alcanzó el 109 por ciento interanual. ""Llama la atención esta evolución dado que es un rubro particularmente protegido por las políticas estatales y porque presenta una sucesión de meses de altos incrementos sin políticas concretas que aborden tal situación"", advierte el informe mensual de inflación del CEPA. En el caso de alimentos y bebidas, el incremento mensual fue de 7,1 por ciento. A nivel productos, se destacó la suba de hamburguesas (10,4 por ciento), cebolla (60 por ciento mensual), papa (32,3), batata (31,7), tomate (19,4) y banana (15,1). El segmento de equipamiento y mantenimiento del hogar avanzó un 8,4 por ciento y acumula en el último año un 79,2 por ciento. En los últimos meses, este rubro presentó las siguientes alzas: 10,3 por ciento en julio, 6,0 en junio y 5,4 en mayo. Transporte registró un aumento del 6,8 por ciento, relacionado a la suba de tarifas del transporte público y combustibles. En tanto, se observó un incremento de 6,7 por ciento en el rubro de restaurantes y hoteles, luego de los ya altos valores de julio (9,8 por ciento), junio (6,2) y mayo (5,7). ""Esto contrasta con la contundente política pública implementada a través del Programa PreViaje"", indica el CEPA. En el caso de salud, el aumento fue de 5,7 por ciento, que se explica principalmente por el ajuste de cuotas de prepagas del orden de 11,34 por ciento. En tanto, vivienda, agua, electricidad y otros combustibles registró aumentos de 5,5 por ciento, al tiempo que recreación y cultura lo hizo al 5,0 por ciento, al igual que educación, y comunicaciones, en un 4,1 por ciento."
"https://www.lanacion.com.ar/politica/inflacion-de-62-en-septiembre-opositores-criticaron-al-gobierno-por-el-rumbo-de-la-economia-nid14102022/","2022-09","La Nación","Inflación de 6,2% en septiembre: opositores criticaron al Gobierno por el rumbo de la economía","El Índice de Precios al Consumidor (IPC) aumentó en septiembre 6,2% respecto a agosto y se redujo ocho décimas con relación al indicador de agosto (7%), informó hoy el Instituto Nacional de Estadística y Censos (Indec). El nivel general del IPC acumuló un alza de 66,1% en los primeros nueve meses del año; y en la comparación interanual registró un incremento de 83%, precisó el organismo. Tras el nuevo dato inflacionario fue criticado por políticos opositores de diferentes espacios que alertaron la “falta de un plan económico” en la administración de Alberto Fernández. Una de las primeras en expresar su mirada en redes sociales fue la titular de PRO, Patricia Bullrich que subió una imagen al revés, con el mensaje: “Un país patas para arriba”. Un país patas para arriba. pic.twitter.com/5MQXEKVei0 En el caso del jefe de Gobierno porteño, Horacio Rodríguez Larreta, analizó: “Este es el dato de lo que vivimos los argentinos todos los días. El país tiene salida y tiene futuro, no perdamos las esperanzas. Construyámoslo juntos”. Este es el dato de lo que vivimos los argentinos todos los días. El país tiene salida y tiene futuro, no perdamos las esperanzas. Construyámoslo juntos. pic.twitter.com/6BPcOaaTYH Por su lado, la diputada y exgobernadora bonaerense, María Eugenia Vidal, utilizó una imagen para graficar la pérdida del poder adquisitivo durante la administración del Frente de Todos: “6,2% fue la inflación de septiembre 2022. Tres años sin un plan económico. Así cayó el poder adquisitivo de los argentinos en el gobierno de los que prometían asado”. 6,2% fue la inflación de septiembre 2022. Tres años sin un plan económico. Así cayó el poder adquisitivo de los argentinos en el gobierno de los que prometían asado. pic.twitter.com/QtBVu3hXmi Su compañero de bancada, Ricardo López Murphy, sumó: “Otro mes de inflación sin control. Ni Alberto Fernández ni Sergio Massa tienen idea de cómo bajarla. Seguirán aplicando medidas inútiles, mintiendo e inventando variables económicas. Argentina estará a la deriva hasta que expulsemos al kirchnerismo del poder”. Otro mes de inflación sin control. Ni @alferdez ni @SergioMassa tienen idea de cómo bajarla. Seguirán aplicando medidas inutiles, mintiendo e inventando variables económicas. Argentina estará a la deriva hasta que expulsemos al kirchnerismo del poder. pic.twitter.com/m2009f6r10 Para Diego Santilli, la alta inflación representa que “El programa ‘Precios Descuidados’ del kirchnerismo está funcionando mejor que nunca”. 6,2% de inflación en Septiembre. El programa ""Precios Descuidados"" del kirchnerismo está funcionando mejor que nunca. Rogelio Frigerio, exministro de Interior y actual diputado de Juntos por el Cambio, dijo: “Se conoció el nuevo índice de inflación de septiembre: 6,2%. Cada vez más cerca del 100% anual y el gobierno sigue sin mostrar un plan serio que pueda bajarla y dar tranquilidad a todos los argentinos. ¿Hasta cuándo?” Se conoció el nuevo índice de inflación de septiembre: 6,2%. Cada vez más cerca del 100% anual y el gobierno sigue sin mostrar un plan serio que pueda bajarla y dar tranquilidad a todos los argentinos. ¿Hasta cuándo? pic.twitter.com/5QJ7LGDlNI 6,2% de inflación mensual y sin resolver ni uno de los problemas de la macroeconomía. Aturde la inacción de los que gritan cuando son oposición, pero callan cuando son gobierno. pic.twitter.com/94eQC2Qb2T La división Prendas de vestir y calzado (10,6%) fue la de mayor aumento en el mes, seguida por Bebidas alcohólicas y tabaco (9,4%), sobre la que se destacó el alza de los cigarrillos. También sobresalió el incremento salarial de trabajadores de casas particulares -que impactó en Equipamiento y mantenimiento del hogar (6%)-, así como las subas de las tarifas del transporte público y el arrastre que dejó el aumento de los combustibles a fines de agosto, que impactaron sobre la división Transporte (5,8%). La suba de Alimentos y bebidas no alcohólicas (6,7%) fue lo que más incidió en todas las regiones, dentro de la que se destacó el aumento de Verduras, tubérculos y legumbres; Aceites, grasas y manteca; y Frutas. A nivel de las categorías, lideró el alza mensual Estacionales (11,7%) “explicada, en parte, por las mencionadas subas en Prendas de vestir, Verduras, tubérculos y legumbres, y Frutas” seguida por el IPC Núcleo (5,5%) y, finalmente, Regulados (4,5%). Secciones Revistas Redes sociales: Descargá la app: © Copyright 2025 SA LA NACION | Todos los derechos reservados. Dirección Nacional del Derecho de Autor DNDA - EXPEDIENTE DNDA (renovación) RL-2023-95334553-APN-DNDA#MJ. Queda prohibida la reproducción total o parcial del presente diario. Protegido por reCAPTCHA: CondicionesPrivacidad Miembro de GDA. Grupo de Diarios América"
