"url","fecha","medio","titulo","cuerpo"
"https://www.lanacion.com.ar/economia/la-inflacion-de-enero-fue-de-36-segun-el-indice-congreso-nid1871442/","2016-01","La Nación","La inflación de enero fue de 3,6%, según el índice Congreso","Ante la falta de datos oficiales sobre los vaivenes de la inflación, los diputados del Frente Renovador y el interbloque Progresistas relanzaron ayer el llamado IPC Congreso. Según este índice, elaborado sobre la base de estimaciones de consultoras privadas, la inflación del mes pasado trepó al 3,6 por ciento, mientras que el valor interanual llegó al 29,9 por ciento. Según el IPC Congreso, la inflación de noviembre fue de 2,2% y la de diciembre, de 3,8%. El índice acumulado en estos tres últimos meses fue de 9,9%. Puntualmente, el rubro alimentos y bebidas creció un 13% en este lapso. Estas cifras se dieron a conocer en momentos en que el Indec informaba oficialmente sobre la salida de Graciela Bevacqua del organismo encargado de elaborar las estadísticas. Bevacqua había advertido que recién en ocho meses se podía contar con índices confiables de inflación, pero en el Gobierno evaluaron que no se podía esperar tanto tiempo sin datos oficiales. De hecho, la oposición -encabezada por Sergio Massa (Frente Renovador), Margarita Stolbizer (GEN), Alicia Ciciliani (Partido Socialista) y Victoria Donda (Libres del Sur)- aprovechó el bache oficial para relanzar ayer el IPC Congreso. La presentación estuvo a cargo del diputado Marco Lavagna (Frente Renovador), quien señaló que se trata de una ""herramienta de información para que la gente pueda defender su bolsillo"". ""No hay una intencionalidad política"", aseguró. En este sentido, Massa pidió al Gobierno ""que haga el esfuerzo de acelerar"" la divulgación de datos oficiales, y se mostró ""dispuesto a colaborar en la reorganización del Indec"" luego de lo que definió como un ""apagón estadístico"" durante el kirchnerismo. ""Todos los dirigentes tenemos la obligación de cuidar el bolsillo de la gente"", sostuvo el líder del Frente Renovador, quien exigió ""que cuando termine 2016 no haya un solo argentino que haya perdido ni un kilo de arroz con respecto a 2015"". A su turno, Stolbizer aclaró que la difusión del llamado ""IPC Congreso"" -que hasta el año pasado emprendían los propios diputados del Pro- ""no es una embestida en contra de nadie"" y propuso ""discutir la creación de un nuevo sistema estadístico"" en el Congreso. ""No hay posibilidad de gobernar sin datos estadísticos"", advirtió Stolbizer. Ciciliani, del Partido Socialista, criticó la decisión de tomar como referencia los índices de la Ciudad de Buenos Aires y San Luis. ""Ningún índice provincial refleja la heterogeneidad del país"", explicó la santafecina. ""La sociedad necesita un índice de referencia sobre todo en momento de paritarias"", remarcó Donda, la más dura en términos de críticas a la gestión macrista, al rechazar los ""tarifazos"" y la reciente eliminación de las retenciones para el sector minero. El Ministerio de Hacienda valoró ""positivamente"" la presentación del Congreso. Y destacó las similitudes de las mediciones que presenta el Congreso y las del Palacio de Hacienda, que confirman la tendencia a la baja en la inflación, luego del salto de fin de año. Secciones Revistas Redes sociales: Descargá la app: © Copyright 2025 SA LA NACION | Todos los derechos reservados. Dirección Nacional del Derecho de Autor DNDA - EXPEDIENTE DNDA (renovación) RL-2023-95334553-APN-DNDA#MJ.
Queda prohibida la reproducción total o parcial del presente diario. Protegido por reCAPTCHA: CondicionesPrivacidad Miembro de GDA. Grupo de Diarios América"
"https://www.pagina12.com.ar/diario/economia/2-292233-2016-02-11.html","2016-01","Pagina12","Contra las subas, preocupación pero no medidas","Jueves, 11 de febrero de 2016 | Hoy ECONOMíA › MACRI ASEGURO QUE SE NECESITARAN “DE DOS A TRES AÑOS” PARA BAJAR LA INFLACION A NIVELES INTERNACIONALES El Presidente acusó a sus antecesores por la inflación, sin detenerse en el impulso que le dio la devaluación. Dijo que su gobierno la resolverá, aunque en dos o tres años. Sin control sobre los formadores de precios, pero con políticas que llevan a una recesión.  Por Raúl Dellatorre En medio de la estampida de precios desatada por la devaluación, la quita de retenciones, la suba de tarifas y el desmantelamiento de todas las medidas de control, y cuando se calienta el clima para las próximas paritarias, el presidente Mauricio Macri se vio en la obligación de mostrar por lo menos preocupación por el castigo que vienen sufriendo los bolsillos de los trabajadores y los jubilados. Pero no comprometió en ello acciones concretas ni resultados cercanos en el tiempo. “Yo quiero decirles hoy que nuestro gobierno está comprometido a reducir la inflación, y hemos dicho que va a ser un camino que va a llevar dos o tres años para llegar a tener una inflación como los demás países de Latinoamérica y del mundo”, es decir por debajo del 10 por ciento. Sin estadísticas oficiales activas y con organismos de monitoreo y seguimiento de precios desmantelados, el gobierno solo apuesta a la “colaboración de los empresarios” formadores de precios, como los supermercadistas, para revertir la ola de aumentos desatados por la devaluación del 40 por ciento en diciembre, realimentada por nuevos ajustes cambiarios del 6,3 por ciento en enero y 3,9 por ciento en lo que va de febrero (seis días hábiles). “Yo les hablé en el 2007, cuando era jefe de Gobierno, de algo muy grave que estaba pasando en Argentina”, dijo Macri en tono profético, ayer hablando ante los empleados del supermercado Coto de Tres de Febrero y ante las cámaras de televisión, en un acto donde anunció inversiones en la ampliación de dicha cadena. “Y que teníamos que estar alertas porque iba a hacer daño, porque un gobierno que se administra mal, lo peor que hace es abusar de la inflación, que es el peor impuesto que se le puede cobrar a la gente”, agregó el Presidente, planteando como una lección de la historia lo que, en realidad, es una muletilla muy repetida por el neoliberalismo desde hace medio siglo (peor impuesto es el desempleo, cuando es causado por decisiones de política económica, porque le quita al trabajador el 100 por ciento de sus ingresos, opinan otros). La disparada del precio de la carne, la harina y sus derivados, los alimentos envasados, los productos químicos utilizados para limpieza, los insumos críticos de la producción manufacturera, y de los alquileres (en un mercado inmobiliario altamente dolarizado) tuvieron estrecha vinculación con la corrección cambiaria y quita de retenciones a las exportaciones dispuesta en forma simultánea por el gobierno en diciembre. La supresión de subsidios a la energía eléctrica y los aumentos en los combustibles impactarán en los costos empresarios, y nuevamente en los precios, este mes y el próximo. La desregulación de mercados, y la eliminación de mecanismos de seguimiento y control de la Secretaría de Comercio serán sustituidos por un pedido de colaboración a las grandes cadenas de supermercados para que publiquen en internet los precios de los artículos para que el comprador compare y elija. El presidente de la Nación ratificó ayer que esa será la única política en lo inmediato para terminar con la inflación. “Nos queremos preocupar por los precios, y con la colaboración de Alfredo (Coto) y de los demás supermercados, les hemos pedido a todos que publiquen en internet sus precios para que, con una aplicación de celular, cualquier argentino pueda chequear donde encuentra el mejor precio y así defender su salario; y ahí estaremos todos, controlando que se publiquen los precios y ayudando de esa manera a que esta paulatina reducción de inflación afecte lo menos posible a todos los argentinos”. Desde el punto de vista redistributivo, tanto la megadevaluación como la quita de retenciones han jugado en favor de los grupos económicos más concentrados y en contra de la mayoría de la población. Por otra parte, los sectores exportadores de cereales, a los que se le cedió en la práctica el control del mercado cambiario, han retaceado la liquidación de ventas externas para empujar el dólar hacia arriba. Así, la política desregulatoria ha facilitado conductas que impulsan nuevas oleadas inflacionarias. El Gobierno, con todo, confía en que esta estrategia, sumada a la apuesta a la contracción monetaria, resultarán a mediano plazo en una desaceleración de la inflación. El camino es conocido: las políticas de “estabilización” sólo son “exitosas” si resultan en una profunda recesión, que frene los aumentos por caída del consumo, consecuencia inevitable de la suba de precios de los productos de consumo masivo y los sucesivos ajustes, que ya empezaron, en los servicios públicos antes subsidiados. El sendero de precios que el ministro de Hacienda y Finanzas señaló en su primera conferencia de prensa, con una inflación cayendo a menos del 10 por ciento en el cuarto año de gestión macrista, está trazado con esa trayectoria. Compartir:    © 2000-2022 www.pagina12.com.ar | República Argentina | Política de privacidad | Todos los Derechos Reservados Sitio desarrollado con software libre GNU/Linux."
"https://www.lanacion.com.ar/economia/la-inflacion-de-febrero-cerca-de-4-nid1878241/","2016-02","La Nación","La inflación de febrero, cerca de 4%","Los hombres que manejan las estadísticas en el Gobierno afilan ya sus números: como consecuencia de la llegada de las primeras facturas de luz con aumentos de hasta 40% en la ciudad y el conurbano, la inflación de febrero habrá llegado al 4 por ciento. La suba de precios no cede. Según confiaron fuentes oficiales a LA NACION, la inflación del mes pasado será similar a la que se registró en el primer mes del año. Según la Dirección General de Estadística y Censos porteña, los aumentos del primer mes del año llegó al 4,1 por ciento. En tanto, el indicador que mide los precios de la provincia de San Luis reflejó para enero una suba de 4,2 por ciento. Se trata de los dos índices recomendados por el Indec luego de que en diciembre comenzara el apagón estadístico tras nueve años de falsificación de los datos oficiales por parte del kirchnerismo. El director del Indec, Jorge Todesca, dijo que el primer número de inflación oficial llegaría en junio con una cifra provisoria en base a los datos de la Ciudad de Buenos Aires y relevamientos propios en la provincia. Además se están cerrando acuerdos con provincias para comenzar el camino hacia la elaboración de un índice nacional. Sin embargo, el Indec no medirá el primer trimestre del año, el período con mayores aumentos y, por lo tanto, no tendrá un dato anual. Según las fuentes consultadas, el mayor impacto en el nivel general de precios vendrá de la mano de los incrementos de tarifas de alrededor de 500% en la Ciudad de Buenos Aires y el conurbano. Sin embargo, en febrero sólo llegó parte de esa suba: los expertos creen que apenas 40 por ciento. La mayor parte de las alzas se notarán recién en marzo y en abril, estimaron. Ante la pregunta de este medio, las fuentes no adelantaron cuánto aumentaron el mes pasado los precios de los alimentos, que se habían desacelerado en enero con respecto a las fuertes subas de diciembre. Anteayer, la Fundación de Investigaciones Económicas Latinoamericanas (FIEL) informó que la canasta que determina el umbral de la pobreza para un adulto en la Ciudad de Buenos Aires aumentó en febrero a 2496 pesos. Esto significa que se registró un alza de 31,7% interanual y de 3,7% mensual. Por otro lado, también subió el valor de la canasta que rige el límite de la indigencia para un adulto: ascendió a $ 1350, lo que representa un aumento de 29,3% interanual y 2,9% mensual, indicó la consultora privada. Si se considera una familia tipo de cuatro miembros (hogar compuesto por un matrimonio con una hija de 8 años y un hijo de 5 años) el costo de la Canasta Básica Alimentaria se ubicó en febrero, según FIEL, en $ 4172. Esto representó un aumento de 29% interanual y el de la Canasta Básica Total, en $ 7713 (+31,6%). El Gobierno anunció las quitas de subsidios en un intento por morigerar el déficit fiscal que heredó del kirchnerismo, de casi 7 puntos en relación al PBI. A su vez, redujo el nivel de emisión para frenar la financiación del Tesoro e intentar reducir la inercia inflacionaria que dejó el gobierno pasado y que el actual profundizó con una devaluación de más del 60% del peso, la quita de retenciones y las subas de tarifas. La Secretaría de Comercio, en tanto, multó a los supermercados con sanciones que superan los 8 millones de pesos y comenzó los procedimientos para importar carne y ganado en pie con el objetivo de recomponer stock y frenar la suba de precios en las carnicerías. ""Es probable que la desaceleración [de la inflación] se vea recién en el segundo semestre"", se esperanzó la fuente oficial. Mientras tanto, los bolsillos siguen crujiendo. Suba Fue la variación de precios en enero pasado en la Ciudad de Buenos Aires. Fuentes oficiales dicen que febrero fue similar Secciones Revistas Redes sociales: Descargá la app: © Copyright 2025 SA LA NACION | Todos los derechos reservados. Dirección Nacional del Derecho de Autor DNDA - EXPEDIENTE DNDA (renovación) RL-2023-95334553-APN-DNDA#MJ.
Queda prohibida la reproducción total o parcial del presente diario. Protegido por reCAPTCHA: CondicionesPrivacidad Miembro de GDA. Grupo de Diarios América"
"https://www.pagina12.com.ar/diario/economia/2-294285-2016-03-11.html","2016-02","Pagina12","La inflación sigue su marcha a todo vapor","Viernes, 11 de marzo de 2016 | Hoy ECONOMíA › EL íNDICE DE PRECIOS DE LA CIUDAD ARROJó UNA SUBA DE 4 POR CIENTO EN ENERO En lo que va del año, el incremento acumulado es de 8,3 por ciento y llega a 32,9 en términos interanuales. Durante febrero, el mayor impacto correspondió al ajuste en las tarifas de electricidad. En menor medida impactaron los alquileres y los peajes. El Indice de Precios al Consumidor de la Ciudad de Buenos Aires (Ipcba) arrojó el mes pasado un aumento del 4 por ciento, lo que aceleró la suba interanual a un 32,9 por ciento, según la Dirección General de Estadística y Censos porteña. El Ipcba, una de las dos mediciones testigo que utiliza el gobierno de Mauricio Macri mientras se mantiene el apagón estadístico, acumula un alza de 8,3 por ciento en el primer bimestre y de 12,5 por ciento si se incluye a diciembre. Durante febrero los servicios subieron 5 por ciento mensual, mientras que los bienes lo hicieron en 2,9 por ciento. El aumento en los servicios respondió principalmente al impacto en el ajuste de las tarifas eléctricas y, en menor medida, a alquileres y cuotas de medicina prepaga. La denominada inflación núcleo, que no contabiliza las subas de los servicios públicos ni de productos estacionales, registró una variación de 2,7 por ciento en el mes. El ministro de Hacienda, Alfonso Prat-Gay, reconoció ayer que en los primeros meses del año la suba en los precios minoristas fue elevada, con un 8,3 por ciento entre enero y febrero, aunque descartó que haya una inercia inflacionaria y vaticinó una mejoría de cara al futuro (ver aparte). No obstante, las cifras difundidas por el Ministerio de Hacienda porteña reflejan una aceleración en los precios. En lo que va del año los servicios acumulan un alza de 8,7 por ciento y los bienes de 7,8 por ciento. Estos últimos estuvieron apuntalados por incrementos en alimentos y en artículos de tocador y limpieza. “En términos interanuales, ambos agrupamientos aceleraron su ritmo de suba hasta el 30,9 por ciento en el caso de los servicios, 4,2 puntos más que en el mes previo, y un 35,1 por ciento en bienes, 2,2 puntos por encima de enero”, resalta el informe del ente estadístico. Desde octubre pasado, mes en que el entonces candidato a ministro Alfonso Prat-Gay aseguró que iban a devaluar en caso de ganar las elecciones, los incrementos en los principales rubros alimenticios subieron hasta más de un 40 por ciento, mientras que la suba de la electricidad registró, según el índice, un incremento de 253,3 por ciento, pese a que el ajuste contempla subas de hasta el 700 por ciento para algunos clientes. En alimentos, desde octubre se destacan aumentos en pan (13,5 por ciento), carnes (25,5), pescados (22,2), aceites (14,4), leche (13,3), frutas (42,5) y azúcar (13,9). El rubro verduras fue el único que registró una baja de 1,9 por ciento desde octubre. “En febrero se registraron aumentos en todas las divisiones del Ipcba, en donde se destacaron Vivienda, agua, electricidad y otros combustibles, Alimentos y bebidas no alcohólicas, Equipamiento y mantenimiento del hogar, restaurantes y hoteles y Salud, que en conjunto explicaron el 77,3 por ciento de la variación mensual del Nivel General”, detalla el informe del ente porteño. En este marco, la incidencia del ajuste en las tarifas aportó 1,29 punto porcentual a la medición del Ipcba, que junto con la medición de San Luis, son utilizados como muestras por el gobierno hasta que vuelvan a publicarse los índices por parte del Indec, lo que sucedería a mitad de año. En la medición interanual, la suba de los precios al consumidor se aceleró hasta el 32,9 por ciento. Los rubros Alimentos y bebidas no alcohólicas evidencian una suba interanual del 32 por ciento; Vivienda, agua, electricidad y otros combustibles, un 36,8 por ciento; Recreación y cultura, 37,2 por ciento; Restaurantes y hoteles, 30,9 por ciento; y Transporte, 24,5 por ciento. En conjunto explicaron 62,1 por ciento de la suba del nivel general. En Alimentos y bebidas no alcohólicas, se destacaron subas en carnes y derivados, con 41,9 por ciento, leche y productos lácteos y huevos (26,3), pan y cereales (26,3), frutas (58,2) y aguas minerales, gaseosas y jugos (29,5), que explicaron el 79,5 por ciento del alza. Por último, dentro de los denominados rubros regulados por el Estado, el índice registró en febrero un incremento de 12,8 por ciento frente a enero, debido principalmente al ajuste en la tarifa de electricidad. “Así, esta agrupación se aceleró hasta 25,1 por ciento interanual, 13,4 puntos respecto de enero”, señala el informe. Con menor incidencia influyeron los aumentos en las tarifas de los peajes y del taxi. La evolución mensual de “Resto Ipcba”, que da cuenta de subas que no responden a cuestiones estacionales y/o administrativas, fue de 3 por ciento, desacelerándose respecto de los dos meses previos y por debajo de la variación del nivel general. Compartir:    © 2000-2022 www.pagina12.com.ar | República Argentina | Política de privacidad | Todos los Derechos Reservados Sitio desarrollado con software libre GNU/Linux."
"https://www.lanacion.com.ar/economia/llegaria-a-33-la-inflacion-de-marzo-nid1888391/","2016-03","La Nación","Llegaría a 3,3% la inflación de marzo","La suba de precios no afloja, golpea el bolsillo de los argentinos y preocupa al gobierno de Mauricio Macri. Según cálculos oficiales, la inflación de marzo llegará al 3,3%, impulsada específicamente por el precio de los alimentos, la educación, los aumentos en los combustibles y las expensas. Para peor, según los estadísticos cercanos al oficialismo, este mes (cuando se concentran los incrementos de los servicios públicos anunciados la semana pasada) tendrá un piso de por lo menos entre 5 y 6%. ""Lo preocupante es que el precio de los alimentos no cede, no afloja"", indicó una fuente oficial ligada al cálculo de los números. De acuerdo con el experto, los precios de alimentos y bebidas el mes pasado tuvieron un aumento de entre 3 y 4%. Pero además suben fuertemente los rubros de vivienda (por el aumento de las expensas derivado de la fuerte alza de la luz y el gas) y el de transporte (por el alza de los combustibles, especificaron. No obstante, el rubro que se disparó (más allá de que no tiene una fuerte incidencia en el índice) es el de educación, que -estiman los especialistas- habría dado por encima del 10%, en un mes en el que subieron las cuotas de los colegios y el precio de los útiles. ""Es un mes con fuerte estacionalidad"" en este rubro, explicaron. Por otro lado, el capítulo de restaurantes y hoteles, que tiene un peso específico importante en el nivel general, habría mostrado subas por debajo del promedio. Esta semana se difundirán los dos índices oficiales de precios recomendados por el Indec ante el apagón estadístico al que ingresó el organismo en diciembre pasado. El jueves se conocerá el indicador elaborado por la Dirección de Estadística de la Ciudad de Buenos Aires, mientras que el viernes será el turno del indicador de la provincia de San Luis. En el último mes, el Gobierno decidió usar justamente este último índice para actualizar el CER, ya que evita el importante impacto en el IPC de las tarifas en los servicios públicos. Por su parte, el Indec dará hoy una conferencia de prensa, a las 16, para informar detalles sobre el proceso de elaboración del nuevo IPC, que publicaría por primera vez en junio. Secciones Revistas Redes sociales: Descargá la app: © Copyright 2025 SA LA NACION | Todos los derechos reservados. Dirección Nacional del Derecho de Autor DNDA - EXPEDIENTE DNDA (renovación) RL-2023-95334553-APN-DNDA#MJ.
Queda prohibida la reproducción total o parcial del presente diario. Protegido por reCAPTCHA: CondicionesPrivacidad Miembro de GDA. Grupo de Diarios América"
