"url","fecha","medio","titulo","cuerpo"
"https://www.pagina12.com.ar/107789-los-precios-desmienten-la-palabra-oficial","2018-03","Pagina12","La inflación nacional de marzo fue del 2,3 por ciento y acumula 25,4 el último año","La inflación a nivel nacional se ubicó en marzo en 2,3 por ciento y acumula en el primer trimestre un 6,7 por ciento, informó ayer el Indec. De esta manera, casi la mitad de la pauta anual de inflación prevista por el Banco Central del 15 por ciento se consumió en el primer cuarto del año. El principal impulso a los precios provino de alimentos y bebidas, equipamiento del hogar, prendas de vestir y educación. En la comparación interanual, la variación de precios llega al 25,4 por ciento, bastante por encima del nivel de inflación que registraba la economía argentina cuando Cambiemos asumió el Ejecutivo nacional. Frente a 2017, los servicios públicos, impulsados por la política tarifaria, junto a prepagas y remedios y telefonía celular, son la primera causa de arrastre de los precios. El mes pasado, los bienes subieron en forma mensual un 2,2 por ciento, mientras que los servicios lo hicieron en un 2,7 por ciento. En la comparación anual, los bienes avanzaron un 20,9 mientras que los servicios lo hicieron un 34,1 por ciento. La llamada “inflación núcleo”, que excluye a los precios regulados, como las tarifas, midió un 2,6 por ciento en marzo, más que el IPC general. Este indicador suele ser citado por el Gobierno para justificar que la inflación está bajando en el subsuelo de la economía. Sin embargo, ni ese argumento le queda en pie al oficialismo. “El IPC núcleo mostró la mayor variación desde que se publica el IPC Nacional. La aceleración preocupa, ya que sobre este indicador opera principalmente la política monetaria del Banco Central. Durante los primeros tres meses de 2018, la inflación núcleo trepó 6,3 por ciento, más de un punto porcentual por encima del incremento registrado por dicho índice en el primer trimestre de 2017 (5,2 por ciento). La variación interanual del IPC Núcleo pasó de 21,1 por ciento interanual en diciembre de 2017 al 22,4 por ciento interanual en marzo de 2018”, señaló en su informe de ayer la consultora Ecolatina. La aceleración de la inflación núcleo se explica por la mayor devaluación del dólar que se registró desde diciembre del año pasado. La inflación de marzo estuvo dominada por alimentos y bebidas, con el 2,3 por ciento en la medición nacional. La suba estuvo por debajo de la media en el caso del Gran Buenos Aires (2,0 por ciento) y por encima en Pampeana (2,6), Noreste (2,5), Noroeste (3,1) y Patagonia (3,1 por ciento). Casi medio punto porcentual de la suba general de precios durante el mes pasado se explicó por el movimiento de los alimentos y bebidas. A nivel de productos, hay numerosos casos de incrementos que superaron el promedio del rubro. Según el informe oficial, la harina de trigo 0000 subió un 2,6 por ciento mensual, mientras que el arroz blanco simple lo hizo en un 2,7 y los fideos secos tipo guiseros, un 3,7 por ciento. Entre las carnes, al asado subió 2,7; la paleta, un 3,9; el cuadril, un 3,0; la nalga, un 3,2; el pollo entero, 4,5 y el filet de merluza, un 4,3. El azúcar subió un 3 por ciento y la sal fina, 4,5 por ciento. Otro medio punto de inflación vino por el lado de las prendas de vestir, que avanzaron un 4,4 por ciento por la inauguración de la temporada invierno. En la comparación anual, las prendas de vestir y calzado muestran una suba del 17,4 por ciento, bien por debajo del promedio del 25,4 por ciento, lo cual es consistente con un mercado interno relativamente estancado y con el fuerte avance de la ropa importada desde Asia. El capítulo de educación subió un 13,8 por ciento en marzo frente a febrero a partir de las cuotas de los colegios privados. A diferencia de las prendas de vestir (y de los bienes en general), cuyos precios deben arbitrar frente a los importados, los servicios cuentan con mayor margen de maniobra en ese sentido. Por ejemplo, el rubro de educación según el Indec creció en el último año un 33 por ciento, por arriba del promedio. En el primer lugar de la suba interanual está vivienda, agua, gas y electricidad, por la política de tarifazos de los servicios públicos que lleva delante el Ministerio de Energía. El avance interanual de este capítulo es del 48 por ciento, y del 0,6 por ciento en relación a febrero. Un reciente informe del Observatorio de Políticas Públicas de la Universidad de Avellaneda advierte que desde inicios de 2016 se verifican incrementos acumulados promedio del 920 por ciento en energía eléctrica, 930 por ciento en gas natural y del 683 por ciento en agua. El capítulo de comunicación subió un 2,7 por ciento apuntalado por la telefonía celular. Equipamiento y mantenimiento del hogar subió 4,5 por ciento, salud lo hizo en un 1,3 por ciento y transporte, 1,8 por ciento."
"https://www.lanacion.com.ar/economia/dolar/la-inflacion-de-abril-fue-de-27-y-esperan-una-suba-arriba-de-2-en-mayo-nid2134822/","2018-04","La Nación","La inflación de abril fue de 2,7% y esperan que esté por arriba de 2% en mayo","Todos, especialmente en el mundo de los expertos económicos, esperaban para abril un aumento de la inflación superior al 2% gracias al impacto de la suba de las tarifas, principalmente del gas y del transporte. No hubo sorpresas. Pero otro pronóstico, impulsado desde el oficialismo, era que a partir de mayo la inflación iba a estar por debajo de ese límite, comenzando un proceso de desinflación en el que se sostienen las paritarias. Pero el dólar cambió todo. La depreciación del peso llevará el IPC de mayo a niveles elevados. Según la información que difundió hoy el Indec, la inflación de abril fue de 2,7%, impulsada por los rubros de vivienda, agua, electricidad, gas y otros (8%); transporte (4%), y prendas de vestir y calzado (4%). Los Alimentos y Bebidas subieron un 1,2%. En el año, la inflación acumula un aumento de 9,6%, de acuerdo a los datos brindados hoy. A doce meses, la suba de precios muestra un alza de 25,5%, según los datos del organismo público. Fundamentalmente, este incremento tuvo que ver con las subas del gas, el transporte y la nafta, explicaron los expertos. La inflación núcleo, que elimina precios regulados y estacionales, fue alta también este mes. La medida que sigue de cerca el Banco Central (BCRA) llegó a 2,1% en abril. En medio de la corrida del dólar y gracias a la persistencia de este dato, los analistas esperan ahora un mantenimiento de las tasas elevadas de interés de referencia del Central. A contramano, desde el sector productivo ya alerta sobre el impacto de estas medidas en el crecimiento. Ayer, el propio Nicolás Dujovne señaló que se prevé ""más inflación y menos crecimiento"". La meta oficial del 15% ya está descartada, tras las fuertes subas de tarifas y la depreciación del peso. Pese a que el ancla inflacionaria sigue siendo la paritaria. Incluso hoy se firmó el acuerdo correspondiente a 2018 para el sector metalmecánico. Según el Ministerio de Trabajo, contempla un aumento del 15% a ejecutarse en dos tramos: 10% en mayo y un 5% en septiembre. Se acordó una revisión del acuerdo a realizarse en diciembre. ""El registro de inflación de abril se acelera respecto al de marzo"", estimó a LA NACION Gabriel Zelpo, economista jefe de Elipsys, que explicó que el dato es levemente superior a la estimación de la consultora privada (2,6%). Zelpo explicó que el registro se vio afectado principalmente por los rubros de Vivienda y Servicios del Hogar, Transporte e Indumentaria. El primero registró una variación mensual explicado fuertemente por el incremento en la tarifa de Gas (32% en el promedio nacional). Mientras, Transporte mostró un aumento con una fuerte incidencia del alza en los combustibles y el transporte público. ""El registro de la inflación núcleo se ubica en 2,1%, frente al 1,7% registrado por nuestro índice. De esta manera, ese dato promedio de tres meses de inflación núcleo se incrementa a 2,3%, frente al 2,1% de marzo"", afirmó el especialista. ""Para mayo prevemos un registro cercano al 2%. El registro se explica principalmente por persistencia de la inflación núcleo, y el incremento en la tarifa de agua corriente, con un aumento de 25%"", estimó Zelpo. ""El dato a destacar del IPC es que la inflación núcleo continúa en niveles elevados. En abril fue 2,1% y durante los últimos tres meses, cuando se sintió el impacto de la suba del tipo de cambio de enero y los efectos segunda ronda de las tarifas, promedió 2,2%. Vale recordar que llegó a 1,3% a fines de año pasado"", coincidió Martín Alfie, economista jefe de Radar. Alfie dijo que el rubro de Indumentaria explicó cerca del 10% del aumento de la inflación de abril. ""En parte es un ajuste estacional por el comienzo de la temporada otoño-invierno"", señaló. ""La inflación de mayo seguramente mostrará un nivel elevado por la suba del tipo de cambio, aunque hay un menor impacto de regulados. La inercia que dejan los meses previos son un piso difícil de romper. Si bien es temprano para ver el traspaso, podríamos terminar con la inflación núcleo unos escalones más arriba"", agregó el economista. ""No va a ser fácil que la inflación termine por debajo de 2%, más allá de cuán alta esté la tasa de interés"", afirmó a este medio Federico Furiase, economista jefe de ECO GO. ""Además, vamos a tener que ver cómo termina esta historia del dólar y la tensión cambiaria"", agregó. ""El dato de abril está en línea con lo esperado, impactado por subas de gas y transporte"", dijo el economista. ""Los estacionales ayudaron"", indicó con relación a la suba de los precios de la ropa. ""Lo que preocupa sigue siendo la inflación núcleo persistente arriba de 2% por el traslado a precios de la suba del dólar"", coincidió Furiase. ""Más allá de abril hay que estar atentos a la inflación de mayo, cuando tenemos el golpe de la suba fuerte del dólar en las últimas semanas. Es prioridad calmar al mercado de cambio y contener las expectativas de devaluación. Ese será el rol de la tasa de interés a niveles altos, lo que pegará en el crecimiento conteniendo las expectativas de que las empresas trasladen a precios"", señaló el economista. ""El dato más relevante pasó por la inflación núcleo, que luego de haber trepado al récord de 2,5% en marzo, bajó a 2,1%, valor similar al de febrero pero aún elevado"", indicó a LA NACION Camilo Tiscornia, C&T Asesores Económicos, quien además agregó que en el rubro de Salud pesó el aumento de los medicamentos para generar un alza de 1,8 por ciento. ""En mayo, al ajuste en el agua y eventualmente el subte, se sumará el impacto de la suba del tipo de cambio de las últimas semanas. Considerando ambos ajustes, nuestro relevamiento de precios arroja una variación mensual algo superior al 2% hasta la fecha"", cerró. El director del Iaraf, Nadín Argañaraz,afirmó que para lograr la meta del 15% la inflación que propone el Gobierno, el promedio mensual no debe ser superior a 0,61%. ""La inflación núcleo de abril anualizada está en 28,3%. La inflación de mayo es altamente probable que tenga un piso del 3%"", anticipó. ""Para el segundo semestre habrá que ir viendo el efecto de la crisis cambiaria y de la suba de la tasa de interés sobre la actividad"", agregó. Para el economista cordobés, la desaceleración que tendría la economía real podría limitar el crecimiento de los precios. Eso sí, ya parece muy difícil que crezcan, por lo menos, por debajo de 22%. ""Estaba previsto que la inflación toque un techo en abril y que, aun sin posibilidades de cumplir la meta, en los meses siguientes volviera a encausarse en un sendero de desaceleración"", escribió Melisa Sala, economista de la consultora LCG. ""Pero el deslizamiento del tipo de cambio sin duda tendrá algún efecto en los precios en los próximos meses, con un rezago aproximado de dos meses, y la inflación se alejará incluso del tercer techo previsto por el Gobierno: perforar la tasa de inflación con que cerró 2017"", agregó. ""Esperamos subas con piso del 2% en los próximos meses que podrían escalar a 3% en junio y julio por el traslado de la devaluación a los precios. Sólo hacia final de año estimamos cierta moderación de las subas"", indicó Sala. Para ella la inflación será de 26,6% en diciembre. Secciones Revistas Redes sociales: Descargá la app: © Copyright 2025 SA LA NACION | Todos los derechos reservados. Dirección Nacional del Derecho de Autor DNDA - EXPEDIENTE DNDA (renovación) RL-2023-95334553-APN-DNDA#MJ.
Queda prohibida la reproducción total o parcial del presente diario. Protegido por reCAPTCHA: CondicionesPrivacidad Miembro de GDA. Grupo de Diarios América"
"https://www.pagina12.com.ar/115076-a-la-corrida-de-precios-no-hay-quien-la-pare","2018-04","Pagina12","La inflación nacional de abril fue la más alta del año, con 2,7 por ciento. En los últimos 12 meses alcanzó el 25,5 por ciento","El principal objetivo en materia económica del gobierno de Cambiemos está cada vez más lejos de cumplirse. Con promesas de campaña alrededor de la enorme facilidad de bajar la inflación, terminar con “ese gran mal que aqueja a los argentinos” como es la suba de precios y así poder ser un “país normal”, el macrismo construyó su discurso económico. Ahora, la caída de ese relato no encuentra piso. La inflación de abril fue del 2,7 por ciento con respecto a marzo por el impacto de la suba de tarifas del gas, el transporte y prendas de vestir, informó ayer el Indec. En cuatro meses, el avance del IPC nacional acumula un 9,6 por ciento y con la fuerte suba que se perfila para mayo y junio como consecuencia de la escalada del dólar, la meta anual de inflación del 15 por ciento quedará cumplida en apenas seis meses. La inflación de abril fue la más alta del año y ese incremento viene acelerando el cálculo anual: desde el 23,4 por ciento interanual en octubre de 2017 hasta el actual 25,5 por ciento, por encima del nivel de suba de precios que recibió Cambiemos al asumir el Gobierno en diciembre de 2015. El Banco Central empeoró en su tarea de cumplimiento de las metas de inflación. En 2016, el Gobierno se propuso tener una inflación del 25 por ciento pero la suba finalmente fue del 41. Esos 16 puntos de desvío implican una brecha del 60 por ciento. El año pasado, la meta fue del 17 por ciento pero la inflación se ubicó en el 24,8 por ciento, una diferencia de 7,8 puntos (error del 45 por ciento). La meta para 2018 es del 15 por ciento, que implica un 5 por ciento cuatrimestral, una brecha de 4,6 puntos en relación a la inflación observada de 9,6 por ciento (92 por ciento de diferencia). La suba de precios esperada para todo el año ahora ronda no menos de 25 por ciento, 10 puntos por arriba de la meta oficial. La inflación del 2,7 por ciento de abril estuvo empujada por un incremento del 8 por ciento en el rubro vivienda, agua, electricidad y gas, que acumula en el año un alza del 51 por ciento. El aumento en las boletas de gas durante el mes pasado dispuesto por el Ministerio de Energía fue de alrededor de 40 por ciento. Las próximas quitas de subsidios en gas están previstas para octubre de este año y abril y octubre de 2019. El segundo rubro en orden de relevancia para explicar la inflación de abril fue la suba del transporte, que creció un 4 por ciento. El boleto promedio de colectivo subió de 8,50 a 9,50 pesos, un 11,7 por ciento promedio frente a marzo y casi un 50 por ciento en relación a los 6,50 pesos de comienzos de año. En tanto, el pasaje de tren subió un 12 por ciento para las líneas Mitre, Sarmiento y San Martín. En junio habrá una tercera dosis de incrementos en transporte. “El proceso de desinflación ya estaba en pausa antes del salto del dólar”, advirtió en su informe de inflación la consultora Ecolatina. Uno de los argumentos que presenta es el avance del 2,1 por ciento del denominado IPC-Núcleo, que excluye a los regulados y los estacionales del análisis de los precios. En cuatro meses, el incremento del IPC-Núcleo es del 8,6 por ciento, 1,2 punto porcentual por encima del dato del primer cuatrimestre de 2017. “Dado que la política monetaria del Banco Central tiene una mayor incidencia sobre estos precios –en relación al IPC Núcleo–, su aceleración es la más preocupante”, agregó Ecolatina. El rubro de prendas de vestir y calzado subió un 4 por ciento por el inicio de la temporada otoño-invierno, mientras que restaurantes y hoteles avanzó un 2,3 por ciento. Recreación y cultura lo hizo en un 1,9 por ciento y salud, en 1,8 por ciento. Las prepagas ya anticiparon una nueva suba de las cuotas del 7,5 por ciento a partir de junio. En conferencia de prensa, ayer el ministro de Hacienda, Nicolás Dujovne, repitió que “estamos convencidos de que la inflación va a bajar”, vinculó los aumentos de precios en abril a la política tarifaria y pronosticó que en mayo la inflación será inferior a la de abril, a pesar de la devaluación (ver aparte). El capítulo de alimentos y bebidas no alcohólicas subió un 1,2 por ciento mensual en abril, por debajo del promedio de la economía, acumula un alza del 8 por ciento en lo que va del año y un 19,9 por ciento en la comparación de abril frente al mismo mes de 2017. El desagregado por productos muestra que los huevos de gallina se destacaron con un incremento mensual del 9,6 por ciento, mientras que la harina de trigo 000 lo hizo en un 6,5 por ciento y el queso cremoso, un 5,8 por ciento. La manteca subió 5,5; la carne picada, 4,2; el pan francés, 3,3; hamburguesas congeladas, un 3,1; el filet de merluza,un 4,9 y el aceite de girasol, 4 por ciento. Si bien Dujovne dijo que la inflación de mayo será inferior a la de abril, la escalada del dólar durante el mes (del orden del 16 por ciento) complica el cumplimiento de esa proyección. El traslado a precios de la devaluación obligó a las consultoras a recalcular su estimación de inflación para mayo. La firma EcoGo calcula un avance de precios del 2,7 por ciento, Ferreres pronostica un 2,4 y el Observatorio de Políticas Públicas de la Universidad de Avellaneda, un 2,9. En mayo también tiene impacto el aumento del 23 por ciento en la boleta de Aysa."
"https://www.lanacion.com.ar/economia/dolar/la-inflacion-fue-del-21-en-mayo-y-acumulo-119-en-los-primeros-cinco-meses-del-ano-nid2143950/","2018-05","La Nación","La inflación fue del 2,1% en mayo y acumuló 11,9% en los primeros cinco meses del año","Los primeros coletazos de la devaluación sobre los precios ya comienzan a sentirse. La inflación de mayo fue del 2,1% y acumuló 11,9% en los primeros cinco meses del año, según el informe difundido hoy por el Indec . A su vez, el organismo estadístico informó que en 12 meses el Índice de Precios al Consumidor (IPC) acumula un alza del 26,3%. La inflación núcleo, que excluye de la medición los precios regulados y los estacionales, fue del 2,7% en mayo, el valor más alto en lo que va de 2018. Según el Indec, los estacionales subieron un 2,5% y los regulados, un 0,4%. La categoría Alimentos y bebidas subió en el mes un 3,3%, afectada por el salto en el tipo de cambio que comenzó a fines de abril. En cinco meses, registra un alza del 11,5%. Los rubros Comunicación (3,9%), Recreación y cultura (2,5%) y Restaurantes y hoteles (2,4%) fueron otros con incrementos superiores al promedio general. El escenario fue disímil en las distintas zonas geográficas. En Cuyo se registró la inflación más baja (1,8%) y en el Noreste, la más alta (2,6%). El mapa se completa con Gran Buenos Aires (1,9%) y las regiones Pampeana (2,2%); Noroeste (2,3%) y Patagonia (2%). Secciones Revistas Redes sociales: Descargá la app: © Copyright 2025 SA LA NACION | Todos los derechos reservados. Dirección Nacional del Derecho de Autor DNDA - EXPEDIENTE DNDA (renovación) RL-2023-95334553-APN-DNDA#MJ.
Queda prohibida la reproducción total o parcial del presente diario. Protegido por reCAPTCHA: CondicionesPrivacidad Miembro de GDA. Grupo de Diarios América"
"https://www.pagina12.com.ar/121716-el-indec-m-le-hizo-precio-a-la-inflacion","2018-05","Pagina12","El IPC nacional de mayo dio 2,1 por ciento, por debajo de estimaciones privadas","El Indec calculó que la inflación de mayo a nivel nacional se ubicó en el 2,1 por ciento, impulsada por alimentos y bebidas, telefonía celular y bienes durables. Para el organismo oficial, ese fue el resultado de la suba del dólar del 22,2 por ciento en el mes –de 20,90 a 25,55 pesos– a raíz de la corrida cambiaria que llevó al Gobierno a pedir un salvataje financiero al FMI y que no cesa a pesar del anuncio del acuerdo con el organismo internacional. El 2,1 por ciento de inflación del Indec quedó por debajo de las estimaciones de consultoras y de otros centros de estudio. La suba de precios acumulada en cinco meses es del 11,9 por ciento según las estadísticas oficiales. Por su parte, los precios mayoristas subieron en mayo un 7,5 por ciento, lo que enciende nuevas luces de alarma sobre la inflación en los meses que se vienen (ver aparte). El instituto de estadísticas porteño informó ayer que la inflación en ese distrito fue del 2,3 por ciento en mayo. La suba de precios para los porteños es del 27,2 por ciento en la comparación interanual y del 12,3 en cinco meses. La inflación para este año no tiene techo, expresión que se ajusta a la realidad en forma literal: el Gobierno, que siempre ponderó su sistema de metas de inflación, admitió que 2018 se quedó sin meta. La eliminación de esa referencia en un contexto de continua suba del dólar -ayer cerró en 28,44 pesos–, los esperables aumentos de combustibles y servicios públicos, que están dolarizados, y la típica respuesta de otros bienes y servicios al movimiento de la divisa llevan la expectativa de inflación anual por encima del 30 por ciento. Por ahora, la comparación frente a mayo de 2017 arroja un 26,3 por ciento. El nivel de inflación nacional del 2,1 por ciento se explica en primer lugar por la suba de precio de los bienes, lo cual implica un cambio frente a la inflación “clásica” de Cambiemos. En los últimos doce meses, los servicios subieron 34,3 por ciento empujados por la quita de subsidios a las tarifas, mientras que los bienes lo hicieron en un 22,2 por ciento. El mes pasado, los bienes avanzaron 2,7 y los servicios, 1,1 por ciento. La inflación núcleo, que no incluye la evolución de precios regulados, se ubicó en 2,7 por ciento, en tanto que en doce meses quedó en 23,6. Entre los bienes se destacó el avance del 3,3 por ciento en alimentos y bebidas, que afecta especialmente a los sectores de menores ingresos, ya que destinan una mayor proporción de su presupuesto a estos gastos. Como fue anticipando en este diario en varios artículos, a medida que se desarrollaba la devaluación, un producto central que subió fuertemente fue la harina de trigo común 000, en un 31,2 por ciento mensual según el Indec. También subieron derivados de la harina, como el pan francés (8,7), galletitas dulces (2,9), galletitas de agua (2,8) y fideos (9,5). El aceite de girasol aumentó 4,8 y la leche en polvo entera, un 2,9. Entre los lácteos, se destacó el avance del queso sardo (2,4), manteca (2,0), yogur firme (2,9) y huevos (7,3). La sal fina subió en mayo 2,8; la yerba mate, un 4,1; la lavandina, 3,4 y los pañales, 2,3 por ciento. El alza de los bienes básicos es consecuencia directa del movimiento del dólar, que en el mes escaló de 20,90 a 25,55 pesos, un total del 22,2 por ciento -en lo que va de junio la divisa norteamericana ya acumula un alza del 11,3–. Otro rubro afectado por la suba del dólar y con alto impacto en sectores de menores ingresos es medicamentos, que motivó un alza del 2,2 en el capítulo de salud. La entidad Consumidores Libres midió aumentos de hasta el 20 por ciento en remedios. Equipamiento y mantenimiento del hogar registró en mayo un incremento del 2,2. La electrónica y la línea blanca tienen alto contenido importado o provienen como bienes finales desde el exterior. La inflación de mayo también estuvo impulsada por los planes de telefonía celular y el precio de los equipos. Prendas de vestir y calzado subió 2,0 y restaurantes y hoteles, 2,4. La medición del Indec quedó por debajo de la estimación realizada  por privados. Elypsis calculó una suba del 2,5, similar a C&T, y Eco Go estimó un 2,2. Para la UMET, estuvo en el 2,8 por ciento y Ferreres anticipó la suba del 2,1 por ciento. En junio, la devaluación del peso junto al aumento en naftas y transporte aceleraría la inflación al borde del 3 por ciento. Un dato que alimenta esa previsión es el incremento del 7,5 de los precios mayoristas el mes pasado."
