"url","fecha","medio","titulo","cuerpo"
"https://www.lanacion.com.ar/economia/inflacion-noviembre-indec-nid2315192/","2019-11","La Nación","La inflación de noviembre fue 4,3% y acumula 48,3% en lo que va del año","La transición tuvo su precio. El bache entre los congelamientos electorales impulsados por Mauricio Macri y el que el mercado prevé que llegará de la mano de Alberto Fernández aceleró más de lo previsto la inflación en noviembre, que marcó -según el Indec- un 4,3%. De esta manera, el índice de precios al consumidor (IPC) acumula 48,3% en lo que va del año y llegó al 52,2% en los últimos 12 meses. En tanto, el componente núcleo -que elimina precios regulados y estacionales- mostró un incremento de 4% en el mes. Para el mes que viene, los analistas esperan un alza de los precios cercana al 4,4%, lo que cerraría el año cerca de 55%. Los analistas coinciden en que las alzas de los alimentos, principalmente, pero también de otros productos y servicios se vincula directamente a una cobertura, para sostener la ya golpeada rentabilidad, frente a posibles acuerdos de precios. Además, creen que algunas decisiones que trascendieron, como el posible uso de la emisión monetaria, baja de tasas, una corrección parcial de tarifas o del dólar contribuirían a mantener elevada la inflación en 2020. En noviembre se registró una fuerte suba en el precio del capítulo de Alimentos y Bebidas, incluso por encima del nivel general. El alza fue de 5,3%. Sin embargo, los mayores aumentos se vieron en Comunicación (7,4%), Salud (6,3%), y Bebidas alcohólicas y tabaco (5,6%). El último Relevamiento de Expectativas del Mercado (REM) que publica el Banco Central (BCRA) había adelantado una inflación de 4,1% en noviembre, superior al 3,3% de octubre pasado. Para fin de año, los economistas privados pronosticaron un alza de 55,6%. Se preveía además que los precios continuaran una leve trayectoria descendente, a 4% mensual en diciembre hasta ubicarse en 3,2% en abril del próximo año. El ministro de Economía, Martín Guzmán, presentó ayer los lineamientos generales de su plan económico, entre los que se encuentra, según dijo, el envío al Parlamento de un proyecto de Solidaridad y Reactivación Productiva que contendría la decisión del nuevo oficialismo de mejorar los ingresos mínimos. Fernández había insinuado en campaña que llamaría a los sectores productivos y del mundo del trabajo para llegar a un acuerdo de precios y salarios. ""Es una suba más alta de lo que se preveía en octubre, pero está en la misma tónica"", aseguró a LA NACION Camilo Tiscornia, director de C&T Asesores Económicos. ""Hay aumentos generalizados en todos los rubros. Empieza a pesar en el trasporte el alza de combustibles, hay subas de prepagas y medicamentos, y también en cigarrillos"", describió. ""Parecería que pierde impulso la presión del dólar, pero que ahora aparece el fenómeno por el que las empresas anticipan que vienen acuerdo de precios, aunque es algo difícil de distinguir. Hubo alzas preventivas. Es muy probable que haya un efecto especulativo"", agregó. ""Este 4,3% nos da levemente por arriba de lo que medimos"", afirmó a este medio Martín Kalos, economista jefe de la consultora Elypsis (daba 4%). ""Tiene mucho que ver en esta suba Alimentos y Bebidas, también hay un alza de prepagas que pega fuerte y que continúa en diciembre, cuando va a haber un aumento mas elevado aún. Por otro lado, subieron además los celulares. Esos son los tres grandes componente de la suba"", dijo. ""La suba estacional de frutas y verduras impacta sensiblemente sobre la inflación de alimentos"", escribió la economista de LCG Melisa Sala. ""También se registró en diciembre una mayor suba en el precio de la carne (+6,7%) con peso en la canasta. Pero, además, entendemos que se produjo cierto adelantamiento de los aumentos como forma de preservar rentabilidad en caso de que el nuevo Gobierno avance en el Acuerdo Social que prometió en campaña"", coincidió la especialista en su informe son sus colegas. ""La cifra del mes de noviembre fue mayor al 3,3% del mes de octubre. La inflación acumulada de los últimos meses y los desajustes de precios relativos, dejan un fuerte arrastre inercial para los primeros meses de 2020"", escribieron los economistas Nadin Argañaraz y Bruno Panighel, del IARAF. ""Para que 2019 cierre con una inflación menor al 54%, la tasa de inflación de diciembre debería descender al orden del 3,8%"", agregaron los especialistas. ""Por el contrario, si la tasa es mayor al 5,1%, la inflación anual superará el 56%. Que el año cierre con una inflación mayor a la de 2018, lo convertirá en el dato anual más alto de los últimos 28 años. Un acuerdo o control de precios de productos básicos puede traer aire en el corto plazo, pero las tasas actuales de inflación requieren alzas de entre 10% y 15% cada trimestre, y esto ocasiona rápidos adelantos y atrasos en el set precios de la economía"", concluyeron. Los especialistas de LCG indicaron que esperan una inflación de 4,4% para diciembre. Con esto, su proyección de inflación anual para 2019 se ubica en 55% anual. ""De cara a 2020, las expectativas de no son alentadoras"", señaló Sala. ""El año inicia con una inflación anualizada en torno al 60%, un 4% mensual y, más allá del éxito que pueda tener el Acuerdo Social sobre el que concentra sus expectativas desinflacionarias el nuevo Gobierno, no existen muchos factores que alienten un proceso de desinflación"", agregó. ""La opción de emitir para financiar la brecha fiscal en un contexto de mercados de deudas voluntarios cerrados, la corrección, total o parcial, que requieren las tarifas por el congelamiento en 2019, la reducción de la tasa de interés para dar impulso a la actividad que podrá volcarse a la demanda de bienes, o bien a la de demanda de dólar libre ampliando la brecha cambiaria, son todos factores que se suman a una inercia inflacionaria todavía muy elevada"", dijo. Secciones Revistas Redes sociales: Descargá la app: © Copyright 2025 SA LA NACION | Todos los derechos reservados. Dirección Nacional del Derecho de Autor DNDA - EXPEDIENTE DNDA (renovación) RL-2023-95334553-APN-DNDA#MJ.
Queda prohibida la reproducción total o parcial del presente diario. Protegido por reCAPTCHA: CondicionesPrivacidad Miembro de GDA. Grupo de Diarios América"
"https://www.pagina12.com.ar/236205-la-inflacion-de-noviembre-fue-del-4-3","2019-11","Pagina12","El último IPC de la era Macri","Por encima del alza de Alimentos y bebidas, se ubicaron los rubros de Comunicación (7,4 por ciento), Salud (6,3) y Bebidas alcohólicas y tabaco (5,6). El congelamiento de los servicios domiciliarios, en los últimos meses del gobierno de Cambiemos, luego de los drásticos híperaumentos de los últimos años, posibilitó que el índice resultara inferior a lo que marcaba la tendencia de aumentos sin control al cierre de los cuatro años del gobierno saliente. El menor aumento reflejado por los rubros Equipamiento y mantenimiento del hogar (0,9 por ciento) y en Vivienda, agua, electricidad, gas y otros combustibles (1,5 por ciento), arrastró a la baja el aumento promedio de precios, que sin ese factor hubiera arrojado una inflación mayor al 5 por ciento en noviembre.  Ese resultado hubiera acercado la inflación del último mes de Macri en el gobierno a los mayores valores registrados en su mandato: 6,5 por ciento en septiembre de 2018, y 5,9 por ciento en el mismo mes de este año. Macri concluyó con una inflación interanual que más que duplicó el ritmo de variación de precios que encontró al asumir el gobierno en 2015, incluso en función de los resultados que publicaba la Dirección de Estadísticas de la Ciudad en ese último año del período kirchnerista. Evaluado por rubro, la inflación en Salud alcanzó este año niveles alarmantes de la mano de la autorización a las empresas que venden medicina prepaga a ajustar prácticamente todos los meses sus cuotas. En noviembre, el índice de precios al consumidor del Indec reflejó un aumento del 6,3 por ciento en Salud, que completa un 63 por ciento en los once meses ya transcurridos de 2019 y el 71,6 por ciento en la comparación interanual (últimos 12 meses). En el rubro Alimentos y bebidas no alcohólicas, el aumento del 5,3 por ciento en noviembre, lleva la suba de los primeros once meses del año al 52,1 por ciento y la de los últimos doce meses, al 54,6 por ciento. Se observa, en la variación por artículo, un fuerte incremento en productos frutihortícolas, carnes rojas y de panadería en noviembre. Por ejemplo, bananas aumentó 48,8 por ciento, tomate redondo 37 por ciento, limón 29,5 y batata 14,6 por ciento en relación a los precios computados por el Indec en octubre. Entre las carnes, asado subió 10,8; cuadril 9,7; nalga 8,6; paleta 8,3 y picada común, 7,2 sólo en el último mes. Además, subuieron fuerte el arroz blanco (8,7 por ciento), galletitas de agua (9,3) y galletitas dulces (5,3) y el pan francés (5,5 por ciento). La política permisiva del gobierno de Macri con respecto al comportamiento de precios de las empresas dominantes en productos de consumo masivo habilitó el abuso de estas firmas que, en las últimas semanas, aceleraron los incrementos para armarse un colchón de precios en previsión de un eventual congelamiento. El gobierno de Alberto Fernández tiene previsto convocar a empresas, sindicatos y organizaciones sociales a un acuerdo de precios y salarios, del cual no podrá quedar al margen los comportamientos evidenciados en las semanas previas por estas empresas grandes y sus consecuencias sobre los precios al público. En CABA El Índice de Precios al Consumidor en la Ciudad de Buenos Aires subió 4% en noviembre y acumuló un incremento de 49% en los doce últimos meses, informó la oficina de Estadística porteña. Los mayores aumentos se verificaron en los reglones de Frutas (26%), Carnes y derivados (5,1) y en menor medida de Pan y cereales (3,9). Por su parte, Transporte registró un incremento de 3,7% y en el rubro Salud se computó una suba del 4,5%, por alzas en los valores de los productos farmacéuticos y en las cuotas de medicina prepaga. En tanto, Recreación y cultura aumentó 4%, debido fundamentalmente a la suba en el abono del servicio de televisión por cable y satelital; Restaurantes y hoteles avanzó 4,1%. El informe de la Dirección de Estadísticas porteño destaca que el rubro Vivienda, agua, electricidad y otros combustibles aminoró su ritmo de suba, hasta 41,5% interanual, fundamentalmente por la postergación de ajustes en las tarifas dispuestos por el gobierno nacional."
"https://www.lanacion.com.ar/economia/precios-la-inflacion-2019-fue-mas-alta-nid2324218/","2019-12","La Nación","Precios. La inflación de 2019 fue la más alta en 28 años y deja un fuerte arrastre para este año","Por una vieja inercia inflacionaria no resuelta desde hace ya más de doce años, las varias devaluaciones que sufrió el peso durante los últimos doce meses, y pese a la política tarifaria de los servicios públicos más controlada del último semestre, la inflación de 2019 -el último año de Mauricio Macri como presidente- fue la más alta en 28 años y deja un significativo arrastre para 2020. El índice de precios al consumidor (IPC) que elabora el Indec reveló esta tarde que la inflación acumulada en el año cerró en 53,8%, luego de que diciembre volviera a mostrar un dato elevado, de 3,7%, que, sin embargo, fue menor al previsto. La inflación núcleo -que no contempla precios regulados ni estacionales- terminó el año en 56,7%, luego de que en el último mes de 2019 mostrara un avance de 3,7%. Con este dato se encadena el décimo quinto año consecutivo con inflación de dos dígitos y el décimo consecutivo con niveles arriba del 20%. Una triste trayectoria. El Relevamiento de Expectativas de Mercado (REM) del Banco Central (BCRA) había estimado para diciembre que la inflación minorista de ese mes se ubicaría en 4,1% mensual. El propio REM esperaba una suba de precios anual fuera de 54,3%. En el año, la mayor suba la tuvo el capítulo de Salud, con un alza de 72,1%. Ahí se combinaron los fuertes aumentos en las prepagas y en los medicamentos. Comunicación avanzó 63,9%, mientras que Equipamiento y mantenimiento del hogar -rubro muy influenciado por el dólar- mostró un alza de 63,7%. Alimentos y bebidas tuvo un aumento de 56,8% en todo 2019. En diciembre, los mayores incrementos se vieron en: Comunicación (9,6%), Salud (5,6%) y en Equipamiento y mantenimiento del hogar (5,4%). Los Alimentos y Bebidas avanzaron 3,1%. La inercia inflacionaria -con un arrastre que se prevé en un 1,3% para el primer mes del año- y la estacionalidad estival, sumado a la vuelta del IVA a algunos alimentos dejan un piso elevado para enero. En 2020, según el último REM, la inflación se estima en una variación cercana al 42,2%. Sin embargo, hay consultoras privadas que prevén que la suba de precios podría llegar hasta 50%. En un programa Stand-By trazado con el Fondo Monetario Internacional (FMI), el gobierno de Macri había elaborado un plan desindexatorio basado en la reducción al mínimo de la emisión monetaria y en el ajuste fiscal por el lado del gasto, que, sin los resultados deseados, terminó derivando en la suba de retenciones a las exportaciones y la baja de reintegros a las ventas en el exterior para hacer caja. La desaceleración de la inflación -en niveles elevados- que logró el equipo de Nicolás Dujovne sufrió golpes por el movimiento del dólar a comienzos de 2019 hasta que el Banco Central (BCRA) logró desanudarse las manos para intervenir. Un nuevo salto de la divisa se dio el lunes posterior al cierre de las primarias obligatorias de agosto, cuyo resultado devolvió incertidumbre a las expectativas de los agentes económicos frente a un posible cambio de gobierno. A partir de entonces, el Gobierno de Macri congeló tarifas, puso un cepo mayorista, frenó alza de combustibles y buscó, con la baja del IVA, amortiguar el salto de los precios en los alimentos básicos atados al valor del dólar. Más allá de esas medidas, la inflación argentina terminó siendo la más alta de la región luego de la que registra Venezuela, sumida en una gran crisis económica. El gobierno de Alberto Fernández, a través de la ley de Solidaridad Social y Reactivación Productiva, elaboró un programa -aún incipiente- de estabilización que busca una desindexación basada en el congelamiento de tarifas por 180 días y del dólar comercial. Desincentivó además la demanda de dólares -luego de que Juntos por el Cambio ampliara el cepo tras las elecciones de octubre y obligara a los exportadores a liquidar divisas, algo que sostiene la nueva gestión- con un impuesto a la compra de divisas para atesoramiento y el uso de tarjetas de crédito. Por otro lado, busca mantener el equilibrio fiscal a través de una política agresiva de ingresos (subas de impuestos) y de baja del gasto, con licuación de jubilaciones desde los $20.000, que estaban indexados por inflación debido a la fórmula que Cambiemos impulsó a fines de 2017. Además, el ministro de Economía, Martín Guzmán, se mostró en contra de una política monetaria desbocada, pese a que la emisión de pesos creció. En sintonía, la tasa de interés de las Leliq comenzó un sendero descendente. El domingo pasado, el Gobierno señaló que busca ""moderación"" en las negociaciones paritarias que se avecinan, que alentará aumentos de salarios en base a las proyecciones futuras de inflación (no habría recuperación de lo perdido en 2019) y que prevé una negociación en torno al 30% para este año. La inflación prevista para 2020, según las consultoras privadas, supera el 42%. En los últimos dos años de la gestión de Macri, los salarios perdieron poder de compra, lo que impactó en el consumo masivo. Además, el ministro de Desarrollo Productivo, Matías Kulfas, decidió no continuar luego del 31 de diciembre pasado con la eliminación de IVA a productos de las canasta básica que había impulsado su antecesor en el cargo, Dante Sica. Pese al acuerdo para amortiguar el impacto (con subas de 7% en los precios y un 14% del impuesto a absorber por la industria y los supermercados) algunos analistas privados creen que la vuelta del gravamen impactará en los datos de la inflación de enero. ""El dato está dentro de lo que se podía esperar, aunque quizás el 3,7% es un poquito menor de lo que se esperaba"", afirmó a LA NACION el economista Camilo Tiscornia, que destacó los importantes aumentos en el año en medicamentos y en alimentos. ""Se notó en los últimos meses la influencia del congelamiento de precios regulados. Por eso, la núcleo da más alta"" dijo y agregó: ""Es un ritmo de inflación muy alto, que se puede repetir en enero, más allá de que algunas cosas te ayudan a que se contenga la inflación. Pero enero es alto por la vacaciones"". ""La suba de precios acumulada del último cuatrimestre y los desajustes de precios relativos, dejan un fuerte arrastre inercial para los primeros meses de 2020"", escribieron Nadin Argañaraz, Bruno Panighel y Julián Illa, economistas del IARAF, en un informe y ejemplificaron: ""Si a partir del 1° de enero los precios dejaran de aumentar, la inflación promedio mínima de 2020 sería de 22% respecto al promedio 2019. Ésta es la magnitud del arrastre estadístico de la inflación 2019"". ""Los congelamientos y controles de precios pueden reprimir a la inflación en el corto plazo, llevando a un aumento de precios menor de algunos segmentos del índice total. Pero las tasas actuales de inflación requieren aumentos de entre 10% y 15% cada trimestre, y esto ocasiona rápidos adelantos y atrasos en el conjunto de precios de la economía"", explicaron y agregaron: ""Los ajustes de precios relativos de los últimos años han sido progresivamente más grandes y a una mayor velocidad, por lo que la inflación se interioriza cada vez más en las decisiones de la sociedad. La economía argentina presenta una nominalidad muy inestable y ahora tenemos tanto precios congelados, como la naftas y tarifas, como precios indexados, como alquileres y créditos UVA, y también precios sin aumentos claros, como jubilaciones y salarios"". ""De cara a 2020, las expectativas no son alentadoras"", señaló la economista de LCG Melisa Sala. ""En el primer trimestre podrá notarse una desaceleración fruto del congelamiento de tarifas y a partir del ancla cambiaria a la que, dentro de un estrecho margen, parece estar apelando el Gobierno. El año inicia con una inflación anualizada en torno al 60% y aún quedan dudas sobre si ambas anclas tendrán efecto desinflacionario permanente, o sólo en el corto plazo mientras estén vigentes"", cerró."
"https://www.pagina12.com.ar/241774-indice-anual-de-precios-por-arriba-del-55-por-ciento","2019-12","Pagina12","El Indec difunde la tasa de inflación de diciembre y la de todo el 2019","EN VIVO El Indec difundirá este miércoles el índice de precios de diciembre. Las estimaciones preliminares ubican el avance de los precios por encima del 4 por ciento mensual. Esto implica una suba acumulada de más de 54 por ciento en 2019. Esta es la inflación más elevada desde 1991. En dos años los precios de la economía se duplicaron y dejaron a la vista el fracaso de la política económica del Gobierno macrista. Los analistas del sector financiero -incluidos en el Relevamiento de Expectativas del Mercado del Banco Central- estimaron que en diciembre la inflación fue 4,1 por ciento y plantearon que para enero los precios marcaran un avance cercano al 3,8 por ciento. La tendencia es descendente para lo que resta del año, hasta alcanzar el 2,8 por ciento mensual en junio, con lo que el acumulado de 2020 estaría en torno al 42,2 por ciento. En lo que respecta a diciembre, la suba estuvo vinculada -según los relevamientos del sector privado- con los aumentos de los precios de los alimentos y bebidas. También con los incrementos del rubro esparcimiento por la llegada de las fiestas de fin de año. Además se registraron subas en la cuota de la medicina prepaga. La inercia de los meses anteriores fue otro elemento clave para explicar la suba de diciembre. El nuevo equipo económico trabaja en distintas estrategias para frenar este fenómeno y lograr en forma gradual ir bajando la tasa de inflación. Desde la consultora Ecolatina aseguraron que hubo también un elemento refugio en las remarcaciones del mes pasado. “Los anuncios sobre congelamientos y acuerdos de precios y salarios no concertados aceleran la inflación en la previa, en la búsqueda por llegar con el máximo oxígeno posible al momento de firmar estos acuerdos o congelamientos"", indicaron en la consultora. Agregaron que la tasa mensual también es alta debido a “la elevada inercia que viene arrastrando desde los últimos tiempos e impone una piso alto"". Las estrategia del equipo económico es proteger de la pérdida de capacidad de compra a los sectores de la base de la pirámide social. Para esto se aplicaron un conjunto de medidas en las que se busca recomponer el ingreso disponible de los segmentos vulnerables de la población y masificar medidas que apuntan a defender el poder adquisitivo. Se destaca en este punto el programa de precios de referencia Precios Cuidados. Conocé todas las opciones del contenido que podés recibir en tu correo. Noticias, cultura, ciencia, economía, diversidad, lifestyle y mucho más, con la calidad de información del Grupo Octubre, el motor cultural de América Latina. Este es un contenido original realizado por nuestra redacción. Sabemos que valorás la información rigurosa, con una mirada que va más allá de los datos y del bombardeo cotidiano. Hace 38 años Página|12 asumió un compromiso con el periodismo, lo sostiene y cuenta con vos para renovarlo cada día."
